text,class,date,aspect,score
O atendimento da recepção deixa um pouco a desejar pois são super secos,0,2025-01-04 20:44:02+00:00,Atendimento da equipe,0.08141203
"Estacionamento Precário; a rampa esta fora dos padrões exigidos pelo regulamentação legal; carros não sobem a rampa, ficam parados no meio e cantam pneu, comprometendo a vida útil do pneu, além de ser perigoso.",0,2024-11-15 00:00:00+00:00,Áreas comuns,0.0127566345
"Única coisa que deixou a desejar foi o atendimento na piscina, na troca de plantão ou quando íamos e não tinha ninguém ficávamos mais de uma hora tentando pedir algo e ninguém aparecia",0,2024-06-08 14:06:13+00:00,Áreas comuns,0.047503892
precisa melhorar um pouco o serviço de limpeza dos quartos e da piscina a de adulta estava suja,0,2024-03-24 22:10:55+00:00,Áreas comuns,0.017998282
"Estacionamento Precário; a rampa esta fora dos padrões exigidos pelo regulamentação legal; carros não sobem a rampa, ficam parados no meio e cantam pneu, comprometendo a vida útil do pneu, além de ser perigoso.",0,2024-11-15 00:00:00+00:00,Áreas comuns,0.0127566345
a única coisa que não gostei muito foi a garagem que ainda está em construção e é no segundo piso,0,2025-03-06 00:00:00+00:00,Áreas comuns,0.25767758
Senti falta de uma tapioca feita na hora e uma sanduicheira que possa prensar o sanduíche.,0,2025-05-20 00:00:00+00:00,Café da manhã,0.10282432
um caos total no estacionamento que é cobrado R$25 a diaria,0,2025-05-05 00:00:00+00:00,Áreas comuns,0.011433819
o terraço com as piscinas não é bom. São pequenas e de difícil acesso para quem tem alguma dificuldade motora (escadas).,0,2025-03-09 00:00:00+00:00,Áreas comuns,0.017728385
Eles não resolveram o meu problema e não ressarciram o estacionamento,0,2025-05-02 22:06:24+00:00,Atendimento da equipe,0.010502641
"o frigobar velho tinha apenas 4 aguas e 4 refrigerantes, os quais nem gelados ficavam",0,2025-02-28 23:36:38+00:00,Quarto,0.032397892
Café da manhã repetitivo ficamos 4 dias e era sempre a mesma coisa trocava uma coisa ou outra.,0,2025-05-05 00:00:00+00:00,Café da manhã,0.19074522
buraco no teto do box de gesso com papel higiênico pendurado (usaram para tampar o buraco),0,2024-08-13 11:37:46+00:00,Banheiro,0.21983348
"Fomos tirar o carro do estacionamento, e caía um pé d'água, meu marido esperando em frente ao interfone e nada de abrir. Resumindo: Teve que voltar pro quarto se trocar devido ao banho de chuva. Totalmente ruim aquele estacionamento!",0,2024-06-25 12:39:17+00:00,Áreas comuns,0.013032899
O único ponto negativo é o horário de check-out que os hotéis estão aplicando.,0,2025-01-14 16:27:57+00:00,Atendimento da equipe,0.020521658
O chuveiro também demorava muito para esquentar (5 minutos nao era exagero) e la se iam centenas de Litros de água desperdiçadas,0,2025-03-22 00:31:14+00:00,Banheiro,0.010075305
estacionamento um caos na estrada e saída nunca funcionava o Ticket,0,2025-01-03 00:00:00+00:00,Áreas comuns,0.014488218
a única coisa que não gostei muito foi a garagem que ainda está em construção e é no segundo piso,0,2025-03-06 00:00:00+00:00,Áreas comuns,0.25767758
infelizmente peca no suco de laranja que é integral,0,2025-02-15 00:00:00+00:00,Café da manhã,0.011761875
"No check-out, a água estava lá na prestação de contas do quarto, eu falei novamente e o funcionário disse que eu precisava escrever o motivo de pedir para tirar a água do valor total.",0,2025-02-06 17:56:02+00:00,Atendimento da equipe,0.4572105
"as toalhas poderiam serem melhores, são muito fracas.",0,2025-06-08 00:00:00+00:00,Quarto,0.02060728
"a camareira tocou 2x a campainha perguntando se eu não iria querer a limpeza, sendo que nesse intervalo que fiquei fora seria o suficiente para que a mesma realizasse",0,2025-06-16 19:41:29+00:00,Atendimento da equipe,0.40335166
"as três piscinas estavam sujas , parecia ter lodo a única que estava menos pior era a piscina infantil",0,2025-01-22 00:20:21+00:00,Áreas comuns,0.014625893
"Estacionamento péssimo, abandonado.",0,2024-06-09 11:42:39+00:00,Áreas comuns,0.012849979
"No sábado, sai do hotel antes das 8 da manhã, retornei depois das 15hrs da tarde e a limpeza ainda não tinha sido realizada",0,2025-06-16 19:41:29+00:00,Atendimento da equipe,0.229063
inexplicavelmente salgadas e de água com aspecto de suja,0,2024-01-05 18:56:09+00:00,Áreas comuns,0.019621897
não tem elevador e todo o trajeto precisa ser feito por escada,0,2025-05-02 22:06:24+00:00,Áreas comuns,0.3208024
a cancela do estacionamento deve ser um mistério não sabem dar instruções e todas q eu recebi estavam erradas resumo fiquei pedindo pra abrir o portão e mostrando o comprovante,0,2025-01-16 00:00:00+00:00,Áreas comuns,0.009328274
O atendimento da recepção deixa um pouco a desejar pois são super secos,0,2025-01-04 20:44:02+00:00,Atendimento da equipe,0.08141203
Seria ao menos correto informarem no check in sobre as opções para estacionar o carro.,0,2025-07-15 00:00:00+00:00,Áreas comuns,0.2698766
"Tem que subir as escadas, igual um labirinto. escadas todas molhadas, pra subir o carro um inferno",0,2025-06-22 12:55:05+00:00,Áreas comuns,0.012491829
"fui mal atendida por parte da equipe, desacreditada por uma funcionária e exposta a uma situação emocionalmente muito difícil.",0,2025-05-09 21:45:30+00:00,Atendimento da equipe,0.014000874
Senti falta de uma tapioca feita na hora e uma sanduicheira que possa prensar o sanduíche.,0,2025-05-20 00:00:00+00:00,Café da manhã,0.10282432
ninguém se dispõe a ajudar então tem que descer escadas e subir com as malas no estacionamento,0,2025-01-18 00:00:00+00:00,Áreas comuns,0.02528492
"novamente apenas o edredom de solteiro , liguei na recepção para resolver , demoraram mais de 20 minutos para trazer e ainda trouxeram um edredom de solteiro",0,2025-04-30 05:48:26+00:00,Quarto,0.040565096
"A acústica é ruim então tinha barulho das 6 da manhã à meia noite, além do elevador fazer um som de batida toda vez que para num andar.",0,2024-10-22 00:00:00+00:00,Quarto,0.0105261905
"trata-se de um bar próximo a recepção do hotel com espaço pequeno e repleto de mesas para duas pessoas do tipo arredondada que para utilizar com mais convidados, se faz necessário juntá-las, o que fica igualmente ruim já que são pequenas demais.",0,2025-06-05 01:11:23+00:00,Restaurante/Bar,0.028545639
O chuveiro também demorava muito para esquentar (5 minutos nao era exagero) e la se iam centenas de Litros de água desperdiçadas,0,2025-03-22 00:31:14+00:00,Banheiro,0.010075305
falaram que erraram o pedido e no lugar deram dois lanches frios que já estavam prontos pelo equívoco,0,2025-01-03 00:00:00+00:00,Restaurante/Bar,0.010183804
"Apenas o estacionamento pago deixa a desejar que fica na parte externa e precisa tocar uma campainha, pra quem precisar usar pode ser um problema",0,2024-08-28 02:25:25+00:00,Áreas comuns,0.01868393
"Péssimo isolamento acústico, portas com frestas (luz e ruído) e um ar-condicionado pendurado na parede do quarto (vibração e ruído).",0,2024-04-30 16:55:31+00:00,Quarto,0.017330928
"é uma falta de respeito com o cliente, cobrar o estacionamento de moto, e ainda ter que pagar o mesmo valor de um automóvel",0,2025-05-01 18:44:35+00:00,Áreas comuns,0.010417325
"ao chegar no quarto , o qual foi reservado para um casal tinha apenas 3 camas de solteiro",0,2025-04-30 05:48:26+00:00,Quarto,0.28448096
"Telefonei e expliquei que necessitava realizar uma reunião online e precisava do acesso ao wi-fi, não resolveram, pediram para esperar até fazerem o Check-in mais tarde",0,2025-06-20 00:00:00+00:00,Atendimento da equipe,0.17826667
Fazer overbooking é feio e vocês deveriam ter vergonha.,0,2024-12-22 22:37:48+00:00,Experiência,0.0105484985
"Tive um episódio pra lá de desagradável, esqueci um óculos de sol no bar da piscina na terça feira noite (dias 13) e no dia seguinte fui até o Paraguay e cheguei no começo da noite e dei falta do óculos como sabia que foi o último lugar que estive com ele fui verificar com  se haviam encontrado e o recepcionista que me atendeu já disse que achava difícil pois já havia passado algum tempo, eu disse a ele que o tempo não importava se tivessem encontrado deveria estar nos perdidos que eles deveriam ter algum lugar assim no hotel, ele disse que não tinham mas que avisaria a governança,  saímos pra jantar, quando voltamos perguntei se tinham notícia ele me disse que sim,  que o óculos havia sido encontrado e que seria entregue no quarto no dia seguinte, inclusive descreveu o óculos, a entrega não ocorreu, a noite fui na recepção de novo e aí o mesmo recepcionista me disse que não sabia de nada e fez nova solicitação eu o vi digitando, na manhã de sexta quando deveríamos sair do hotel voltamos a verificar e aí a coisa piorou de vez todos na recepção disseram que não havia aviso na governança e a governanta disse que não sabia de nada e recepcionista que estava no momento disse que quando vi o colega dela digitando no sistema minha solicitação poderia não ter sido que ele provavelmente estava digitando outra coisa, meu marido pediu as imagens da câmeras que ficaram de verificar e entrar em contato conosco, mas até hoje 19/05 não nos deram notícias, meu marido ligou pela manhã e convenientemente depois de algum tempo a ligação caiu misteriosamente e não retornaram.",0,2025-05-19 00:00:00+00:00,Atendimento da equipe,0.02134363
"o chuveiro, muitas vezes não mantém a água aquecida",0,2025-06-11 15:56:44+00:00,Banheiro,0.29496545
"O pior ponto do hotel é a recepção, sem dúvidas. Funcionários que não sabem responder o que você pergunta, alguns bem antipáticos.",0,2025-02-06 17:56:02+00:00,Atendimento da equipe,0.013861804
"ficamos extremamente decepcionados com os itens que estavam disponíveis no Buffet self-service, eram itens bem simples que não condizia com um cardápio de um Almoço de Natal, esperávamos encontrar itens variados típicos de uma data Natália como lombo, pernil, Tender, peru, salada de maionese, salpicão, arroz a grega, uma lazanha, etc... Ao contrário disso encontramos um arroz branco, feijão preto, macarrão alho e óleo, peixe (sem tempero), coxa e sobrecoxa de frango, linguiça, costela e apenas dois tipos de salada simples que comemos no dia-a-dia.",0,2024-12-25 21:48:50+00:00,Restaurante/Bar,0.018891504
Se for buffet os pratos são 4 no máximo e quase sempre de cozinha árabe.,0,2025-04-16 21:15:32+00:00,Restaurante/Bar,0.19911556
Pedi que em qualquer urgência me avisassem e me avisaram após o carro ser multado por parar em local proibido sendo que foi o próprio Hotel que orientou e falou que não haveria problema.,0,2024-07-18 15:17:30+00:00,Atendimento da equipe,0.20882142
Chão sujo,0,2025-01-01 22:37:18+00:00,Quarto,0.120119065
estacionamento é um trajeto extremamente estreito e que ainda está sendo construído,0,2025-05-02 22:06:24+00:00,Áreas comuns,0.49148786
"o banho estava quase perfeito, se não fosse a alternância entre a água quente e fria que tornou a experiência desagradável",0,2024-08-08 01:07:00+00:00,Banheiro,0.4893367
ar com problema quase toda estadia,0,2025-03-26 14:04:53+00:00,Quarto,0.01377313
Acho péssimo ter suco artificial num café de hotel.,0,2025-02-06 17:56:02+00:00,Café da manhã,0.009530476
ar com problema quase toda estadia,0,2025-03-26 14:04:53+00:00,Quarto,0.01377313
chamei ele demorou mais alguns minutos para ver falei `ó apagou Ok vou eu vou resolver` saiu voltou com uma vela colocou uma vela embaixo do Rechaud para aquecer aquela vela Ficou ali 5 minutos e obviamente não aquecia chamei ele novamente falei ó não tá aquecendo,0,2025-07-15 15:12:43+00:00,Restaurante/Bar,0.15988906
"eu escutei a seguinte frase da chefe da recepção : ""vocês não podem me culpar por uma coisa que não aconteceu no meu turno"" ... ou seja, o hotel não é uma empresa como um todo, se o problema aconteceu com a equipe do turno noturno, a equipe do turno diurno não tem nenhuma ""responsabilidade por NADA"" ... e ela ainda se disse a ""responsável pela recepção"" ...",0,2024-12-30 10:30:04+00:00,Atendimento da equipe,0.015466565
não estamos conseguindo tomar banho pois a agua nao está esquentando,0,2024-01-22 02:18:48+00:00,Banheiro,0.11686309
Acho péssimo ter suco artificial num café de hotel.,0,2025-02-06 17:56:02+00:00,Café da manhã,0.009530476
o buffet apenas com 2 tipos de sopa o que não faz nenhum sentido,0,2025-05-29 20:47:29+00:00,Restaurante/Bar,0.019919334
"as tarifas podiam ser mais "" atrativas""",0,2025-07-21 00:20:08+00:00,Experiência,0.5780611
o buffet apenas com 2 tipos de sopa o que não faz nenhum sentido,0,2025-05-29 20:47:29+00:00,Restaurante/Bar,0.019919334
exceto os forro de camas que não está limpo. Tinha cabelo.,0,2025-05-04 00:00:00+00:00,Quarto,0.1058108
No primeiro dia falei na recepção que tinha uma água aberta no frigobar e a atendente anotou. A água continuou lá.,0,2025-02-06 17:56:02+00:00,Atendimento da equipe,0.43794057
o estacionamento é ruim e está em obras,0,2025-01-18 00:00:00+00:00,Áreas comuns,0.018016174
"As piscinas fui frustrante não funcionava muito sujas reclamei na recepção me encaminharam para ouvidoria fui atendida, porém não resolveram nada continuou suja.",0,2025-01-26 23:00:55+00:00,Áreas comuns,0.0106881
uma noite minha filha pediu um caldo de feijão que demorou mais de 1hora para ser servido,0,2024-08-17 10:34:44+00:00,Restaurante/Bar,0.057726726
"Nisso começou uma nova tentativa de check in aí me alocou no quarto 2404, mas isso levou mais 15 minutos",0,2024-05-18 23:05:53+00:00,Atendimento da equipe,0.2071751
Colchão mediano-barato (bom para máx 2 noites).,0,2025-05-06 12:52:51+00:00,Quarto,0.95725125
São 14:08 e nada de liberarem o quarto.,0,2024-11-03 17:28:32+00:00,Atendimento da equipe,0.016244318
apartamentos ... pequeno,0,2025-01-18 00:00:00+00:00,Quarto,0.8196288
"A limpeza dos quartos deixou muito a desejar. Praticamente não foi feita, o que é inaceitável para qualquer hotel que se proponha a oferecer um mínimo de conforto aos hóspedes.",0,2025-01-26 23:00:55+00:00,Quarto,0.012730305
"Primeiro que ao chegar, eles passaram o ramal para ligar, chegando no quarto não tinha telefone.",0,2024-12-07 21:37:10+00:00,Quarto,0.38657582
Muito barulho.,0,2025-04-08 00:00:00+00:00,Quarto,0.97523934
Quarto pequeno.,0,2025-07-06 00:00:00+00:00,Quarto,0.47348812
"Tudo é muito difícil, pois parece que nem entre eles na recepção se comunicam.",0,2025-02-06 17:56:02+00:00,Atendimento da equipe,0.014385932
achei ... o banheiro pequeno,0,2025-04-15 20:11:40+00:00,Banheiro,0.2117255
Falta apenas incluírem cerveja sem glúten no cardápio.,0,2025-01-07 15:07:10+00:00,Restaurante/Bar,0.21010806
piscinas são pequenas e  não estavam com a água idealmente limpas,0,2024-02-14 00:00:00+00:00,Áreas comuns,0.1265232
O restaurante pequeno é muito demorado o atendimento!!,0,2025-01-26 23:00:55+00:00,Restaurante/Bar,0.9741214
"alguns problemas como falta de sinal de Internet e TV são recorrentes,  não adianta reclamar na recepção",0,2025-06-20 13:06:06+00:00,Experiência,0.031590484
"Tem que subir as escadas, igual um labirinto. escadas todas molhadas, pra subir o carro um inferno",0,2025-06-22 12:55:05+00:00,Áreas comuns,0.012491829
"Local para se servir no café da manhã deveria ser revisto pois, é estreito demais",0,2025-03-22 00:00:00+00:00,Café da manhã,0.011359401
"Você  irá  ter um único  cardápio  para todos os dias, ou seja, nos imputaram comer a mesma ""ração "" todos os dias, por um valor R$ 69,90 .",0,2025-01-04 15:52:07+00:00,Restaurante/Bar,0.25099704
Somente a garagem do hotel deixa a desejar.,0,2025-01-06 00:00:00+00:00,Áreas comuns,0.03119022
Experiência deixou a desejar,0,2025-03-18 17:58:59+00:00,Experiência,0.02356845
a academia está com aparelhos para manutenção.,0,2025-01-06 00:00:00+00:00,Áreas comuns,0.4092465
barulho nos corredores do quarto.,0,2024-02-18 00:02:38+00:00,Quarto,0.29450133
Poderia ser um pouco maio.,0,2025-05-24 00:00:00+00:00,Quarto,0.5557673
obs só faltou o salaminho no café da manhã,0,2025-06-12 00:00:00+00:00,Café da manhã,0.5226235
"Primeiro que ao chegar, eles passaram o ramal para ligar, chegando no quarto não tinha telefone.",0,2024-12-07 21:37:10+00:00,Quarto,0.38657582
não gostei das coisas de higiene que tem disponível no banheiro,0,2025-03-27 00:00:00+00:00,Banheiro,0.10574322
"achando que era um queijo branco , não enganou era ricota. Quem come ricota no café da manhã!!!",0,2024-08-08 00:00:00+00:00,Café da manhã,0.013872393
A cama não era muito confortável.,0,2024-03-14 16:17:49+00:00,Quarto,0.06054867
achei ventilação ruim,0,2025-04-27 00:00:00+00:00,Quarto,0.046763696
Comida poderia ser um pouco melhor,0,2025-05-09 00:00:00+00:00,Restaurante/Bar,0.5750563
"E tbm um lado da cama estava afundada, bem desconfortável!",0,2024-04-19 15:37:49+00:00,Quarto,0.014242944
"Os funcionários de maneira geral foram bem educados e atenciosos, exceto a auto-intitulada ""Gerente Tassyla"" que nos tratou de forma bastante inadequada.",0,2025-03-05 00:00:00+00:00,Atendimento da equipe,0.014081398
o ar condicionado faz bastante barulho,0,2025-01-13 00:00:00+00:00,Quarto,0.051421978
achei o quarto ... pequeno,0,2025-04-15 20:11:40+00:00,Quarto,0.65948164
"ficamos extremamente decepcionados com os itens que estavam disponíveis no Buffet self-service, eram itens bem simples que não condizia com um cardápio de um Almoço de Natal, esperávamos encontrar itens variados típicos de uma data Natália como lombo, pernil, Tender, peru, salada de maionese, salpicão, arroz a grega, uma lazanha, etc... Ao contrário disso encontramos um arroz branco, feijão preto, macarrão alho e óleo, peixe (sem tempero), coxa e sobrecoxa de frango, linguiça, costela e apenas dois tipos de salada simples que comemos no dia-a-dia.",0,2024-12-25 21:48:50+00:00,Restaurante/Bar,0.018891504
Muito barulho nos quartos,0,2024-05-18 23:05:53+00:00,Quarto,0.40307468
só nao achei honesto falar que tem estacionamento e cobrar separado,0,2024-10-13 00:00:00+00:00,Áreas comuns,0.013856512
"no andar que ficamos estava em obras em alguns quartos, isso ocasionou poeira e barulho",0,2024-04-07 23:22:45+00:00,Quarto,0.019531703
piscinas são pequenas e  não estavam com a água idealmente limpas,0,2024-02-14 00:00:00+00:00,Áreas comuns,0.1265232
"Nisso começou uma nova tentativa de check in aí me alocou no quarto 2404, mas isso levou mais 15 minutos",0,2024-05-18 23:05:53+00:00,Atendimento da equipe,0.2071751
ponto de atenção e o estacionamento que é pago e apertado.,0,2025-03-02 00:00:00+00:00,Áreas comuns,0.09401326
atendimento por whatsapp ruim,0,2024-01-29 22:00:27+00:00,Atendimento da equipe,0.021698765
faltou só um.pouco mais de simpatia dos recepcionistas,0,2024-01-17 19:53:34+00:00,Atendimento da equipe,0.022108227
A única coisa que diria foi complicada é que a faxina diria não envolve algo mais caprichado.,0,2025-01-26 00:00:00+00:00,Quarto,0.1326286
Fui abordado por uma funcionária com o meu Pires na mão. Constrangimento total desnecessário.,0,2024-10-11 12:57:34+00:00,Atendimento da equipe,0.0127809
"Acredito que para reservas de casal apenas, poderiam retirar essa cama extra que melhoraria o espaco",0,2025-04-25 00:00:00+00:00,Quarto,0.34709054
banheiro Velho com toalhas super velhas,0,2024-02-22 00:00:00+00:00,Banheiro,0.062001284
água acaba e não avisam os hóspedes,0,2025-03-26 14:04:53+00:00,Banheiro,0.056727752
Lençol manchado,0,2025-01-01 22:37:18+00:00,Quarto,0.11630278
Toalhas velhas.,0,2024-01-27 00:00:00+00:00,Quarto,0.76935834
O chuveiro também demorava muito para esquentar (5 minutos nao era exagero) e la se iam centenas de Litros de água desperdiçadas,0,2025-03-22 00:31:14+00:00,Banheiro,0.010075305
"O foundue, não conseguem manter a temperatura adequada para uma boa experiência e alguns itens não tem compatibilidade.",0,2025-06-04 00:00:00+00:00,Restaurante/Bar,0.015530439
Não é um bom custo benefício.,0,2025-04-27 00:00:00+00:00,Experiência,0.026560776
"O café da manhã tem bastante opção porém é repetitivo, com bolos secos e sucos ruins.",0,2024-10-22 00:00:00+00:00,Café da manhã,0.013850707
"ao chegar no quarto , o qual foi reservado para um casal tinha apenas 3 camas de solteiro",0,2025-04-30 05:48:26+00:00,Quarto,0.28448096
a piscina é bem pequena,0,2025-04-27 00:00:00+00:00,Áreas comuns,0.516456
O atendente me disse que preço somente após o lançamento das peças no sistema,0,2024-01-11 13:55:42+00:00,Atendimento da equipe,0.45009562
"Quarto muito apertado, com uma cama de casal e uma de solteiro na parte superior, na qual bati meu nariz, espaço entre a cama e a parede só passa 1 pessoa para ir ao banheiro.",0,2025-04-23 10:46:18+00:00,Quarto,0.021350967
"Apenas atrasos no restaurante, pois aguardamos quase 2 horas para atendimento",0,2025-01-06 00:00:00+00:00,Restaurante/Bar,0.028555887
"Falamos com a proprietária do hotel, que prometeu uma solução e resolução do caso, porém sem sucesso",0,2025-03-08 23:36:12+00:00,Atendimento da equipe,0.20033075
O restaurante demora HORAS para entregar um prato simples com frango e legumes ou até mesmo um hamburguer.,0,2025-04-22 16:01:07+00:00,Restaurante/Bar,0.01397085
Apenas a água quente do chuveiro que demora a aquecer,0,2025-01-11 00:00:00+00:00,Banheiro,0.16181852
"Recepcionistas da noite não são prestativos tive um problema e não fizeram questão de ajudar, além de estarem sempre com a cara fechada",0,2025-01-18 00:00:00+00:00,Atendimento da equipe,0.019684598
Apenas a água quente do chuveiro que demora a aquecer,0,2025-01-11 00:00:00+00:00,Banheiro,0.16181852
"são três piscina, porém muito pequenas",0,2025-02-17 00:00:00+00:00,Áreas comuns,0.28598303
Único ponto negativo é o estacionamento que é pago,0,2025-05-14 00:00:00+00:00,Áreas comuns,0.018927403
O restaurante pequeno é muito demorado o atendimento!!,0,2025-01-26 23:00:55+00:00,Restaurante/Bar,0.9741214
água acaba e não avisam os hóspedes,0,2025-03-26 14:04:53+00:00,Banheiro,0.056727752
"Apenas atrasos no restaurante, pois aguardamos quase 2 horas para atendimento",0,2025-01-06 00:00:00+00:00,Restaurante/Bar,0.028555887
O restaurante demora de uma hora a uma hora e quarenta para servir os pedidos,0,2024-01-05 18:56:09+00:00,Restaurante/Bar,0.09035243
"falta ainda sucos naturais, mais opções de frutas, e alimentação típicas do local",0,2024-08-13 11:37:46+00:00,Café da manhã,0.2869204
"no andar que ficamos estava em obras em alguns quartos, isso ocasionou poeira e barulho",0,2024-04-07 23:22:45+00:00,Quarto,0.019531703
"o serviço de quarto é muito lento, não use",0,2025-04-19 00:00:00+00:00,Atendimento da equipe,0.01249916
"os funcionários no atendimento, principalmente na recepção estão meio robotizados, quase não dão um sorriso e pouco conversam",0,2025-03-25 00:00:00+00:00,Atendimento da equipe,0.012589578
"descemos para fazer o check-out antes do previsto e como imaginamos de novo agora eles tentaram nos mudar de quarto, apenas quando desistimos… mantivemos o check-out mesmo assim.",0,2025-02-07 00:12:10+00:00,Atendimento da equipe,0.14728624
a academia está com aparelhos para manutenção.,0,2025-01-06 00:00:00+00:00,Áreas comuns,0.4092465
"O café da manhã tem bastante opção porém é repetitivo, com bolos secos e sucos ruins.",0,2024-10-22 00:00:00+00:00,Café da manhã,0.013850707
o banheiro fede a esgoto,0,2025-07-15 00:00:00+00:00,Banheiro,0.32722765
péssima limpeza da piscina,0,2025-01-23 00:00:00+00:00,Áreas comuns,0.64405704
"O suco apesar de natural não é dos melhores, sugiro que melhorem o sabor.",0,2025-05-20 00:00:00+00:00,Café da manhã,0.040787313
o banheiro ficar muito molhado também com o chuveiro,0,2024-08-17 10:34:44+00:00,Banheiro,0.022348262
Ar condicionado? Velho e não funciona.,0,2025-02-07 00:12:10+00:00,Quarto,0.035712708
"O estacionamento que antes era cortesia agora é cobrado 25,00 reais por dia",0,2025-06-16 19:41:29+00:00,Áreas comuns,0.39944172
só achei o pessoal que trabalha aqui mal educado,0,2024-12-27 00:00:00+00:00,Atendimento da equipe,0.011767869
"Alguns itens do café da manhã frios, como cuscuz  (tinha acabado de chegar)",0,2025-06-13 00:00:00+00:00,Café da manhã,0.19417952
"A limpeza dos quartos deixou muito a desejar. Praticamente não foi feita, o que é inaceitável para qualquer hotel que se proponha a oferecer um mínimo de conforto aos hóspedes.",0,2025-01-26 23:00:55+00:00,Quarto,0.012730305
"Já o chuveiro eu achei bem fraco, pressão ruim, não sei se foi algo pontual ou se é algo geral do hotel.",0,2025-03-12 08:35:17+00:00,Banheiro,0.022192927
o quarto que me colocaram era muito barulhento,0,2024-10-15 00:00:00+00:00,Quarto,0.012857749
Split do quarto sem refrigerar e consequente água drenando e escorrendo pela parede,0,2024-08-13 11:37:46+00:00,Quarto,0.0467006
"tentei falar no hotel para reaver  ao menos parte de minha diária mas o atendimento foi novamente intransigente e disseram que minha solicitação  não estava na "" política  do hotel""",0,2024-12-05 01:34:23+00:00,Atendimento da equipe,0.037413135
"os atendentes de entrada do hotel são grosseiros, sem nenhuma empatia para com quem está chegando ou saindo, e sequer perguntam o que você achou da estadia",0,2025-02-28 23:36:38+00:00,Atendimento da equipe,0.011572699
Ficaria bem melhor se o estacionamento fosse cortezia o que tornaria um diferencial só hotel,0,2024-10-14 00:00:00+00:00,Áreas comuns,0.31955513
quando reclamei virão que o pedido não tinha sido passado para cozinha (precisam melhorar o foco e agilidade),0,2024-08-17 10:34:44+00:00,Restaurante/Bar,0.021345995
A cama não era muito confortável.,0,2024-03-14 16:17:49+00:00,Quarto,0.06054867
