text,class,date,aspect,score
piscina aquecida,1,2025-04-24 00:00:00+00:00,Áreas comuns,0.5016536
desde o atendimento da recepção ao serviço de limpeza dos quartos,1,2024-12-08 00:00:00+00:00,Atendimento da equipe,0.45525914
"Muito organizado , limpo",1,2025-05-07 00:00:00+00:00,Quarto,0.9862569
como que fizeram um cisne e hm peixe com a toalha? Muito lindo parabens,1,2025-05-14 00:00:00+00:00,Quarto,0.99298227
"Erlon foi extremamente receptivo, educado, simpático, prestativo, cordial e atencioso.",1,2025-04-09 00:00:00+00:00,Atendimento da equipe,0.98718435
Os quartos são bem estruturados e limpos.,1,2024-12-22 00:00:00+00:00,Quarto,0.92430776
profissionais atenciosos,1,2025-03-02 00:00:00+00:00,Atendimento da equipe,0.90956694
fiquei muito feliz com minhas estádias no hotel me suprienderao bastante,1,2024-12-26 00:00:00+00:00,Experiência,0.99042124
Um excelente custo x benefício.,1,2024-08-06 17:30:17+00:00,Experiência,0.99197525
"Quarto limpo, banheiro limpo e tudo muito impecável",1,2025-04-29 00:00:00+00:00,Quarto,0.9834493
"tem sala de jogos, piscina, academia",1,2024-11-12 00:00:00+00:00,Áreas comuns,0.40376505
camareira Josiela excelente pessoa tb,1,2025-05-12 00:00:00+00:00,Atendimento da equipe,0.99428177
"O atendimento foi realizado pelo Whatsapp com muita rapidez, clareza e segurança nas informações.",1,2025-02-12 00:00:00+00:00,Atendimento da equipe,0.9319368
Ótimas opções no café da manhã,1,2024-05-25 10:24:09+00:00,Café da manhã,0.9940338
"recomendo a cuca de banana e o bolo de laranja (amei a geleia por cima), uma delícia",1,2024-05-25 10:24:09+00:00,Café da manhã,0.99448967
Reserva de hospedagem  com Erlon. Excelente atendimento.,1,2025-06-11 00:00:00+00:00,Atendimento da equipe,0.9729919
"Café da manhã maravilhoso, com muitas opções",1,2025-04-20 00:00:00+00:00,Café da manhã,0.98507273
Café da manhã espetacular,1,2025-06-06 00:00:00+00:00,Café da manhã,0.99168533
linda vista do 7. Andar,1,2025-06-06 00:00:00+00:00,Quarto,0.9879839
Tem um restaurante/Bistrô no hotel que oferece pratos deliciosos,1,2025-01-18 00:00:00+00:00,Restaurante/Bar,0.9635992
serviço do bar/restaurante ótimo e de qualidade,1,2025-01-26 15:08:52+00:00,Restaurante/Bar,0.9777287
Profissionais educados e atenciosos,1,2024-04-23 11:57:07+00:00,Atendimento da equipe,0.92668545
"Serviço de quarto muito bom, atendentes educados, quarto aconchegante.",1,2024-12-22 00:00:00+00:00,Atendimento da equipe,0.991001
restaurante,1,2024-06-20 00:59:08+00:00,Áreas comuns,0.44041568
"Quarto, limpeza, café da manhã e atendimento foi muito bom.",1,2024-12-05 00:00:00+00:00,Quarto,0.98669124
recepção muito gentil,1,2025-03-11 00:00:00+00:00,Atendimento da equipe,0.90083
quartos confortáveis,1,2025-05-20 00:00:00+00:00,Quarto,0.694005
"Fabíola que prontamente nos atendeu via telefone e depois WhatsApp, realizando com atenção e agilidade nossa reserva",1,2025-02-24 00:00:00+00:00,Atendimento da equipe,0.97319186
No padrão 4 estrelas,1,2025-05-19 00:00:00+00:00,Experiência,0.7078162
"fomos muito bem recebidos, atendimento excelente!",1,2025-04-24 00:00:00+00:00,Atendimento da equipe,0.97861266
"O hotel é muito bem localizado, com fácil acesso ao estacionamento (cobrado à parte).",1,2025-07-20 21:01:08+00:00,Localização,0.96314883
Os quartos bem organizado e limpos,1,2024-12-06 00:00:00+00:00,Quarto,0.8512208
Atendimento muito cordial dos funcionários,1,2025-04-28 00:00:00+00:00,Atendimento da equipe,0.79527426
"em especial Mariana e Cleberson , q nos trataram muito bem e nos acolheram maravilhosamente",1,2024-12-06 00:00:00+00:00,Atendimento da equipe,0.9898797
"café da manhã perfeito, diverso",1,2024-11-26 21:20:13+00:00,Café da manhã,0.9935902
atendimento atencioso,1,2025-03-24 00:00:00+00:00,Restaurante/Bar,0.7417402
pertinho da ponte da amizade,1,2025-05-04 00:00:00+00:00,Localização,0.8838908
Hotel localizado na região central,1,2024-12-08 00:00:00+00:00,Localização,0.5519868
Café da manhã excelente.,1,2025-03-09 00:00:00+00:00,Café da manhã,0.98333895
A área da piscina é muito bacana,1,2024-11-01 01:14:15+00:00,Áreas comuns,0.97534704
"a equipe é simpatica, muito prestativa",1,2024-03-25 13:43:36+00:00,Atendimento da equipe,0.9872456
Chuveiro bom,1,2024-08-20 20:00:39+00:00,Banheiro,0.9929247
com 3 piscinas,1,2024-12-06 00:00:00+00:00,Áreas comuns,0.44461006
rápida nos atendimentos,1,2024-12-31 00:00:00+00:00,Atendimento da equipe,0.6775553
comida maravilhosa,1,2024-12-21 00:00:00+00:00,Restaurante/Bar,0.979793
comida de qualidade,1,2025-07-07 00:00:00+00:00,Restaurante/Bar,0.73688686
Experiência incrível.,1,2025-07-31 00:00:00+00:00,Experiência,0.9822784
o quarto é MUITO lindo e muito limpo,1,2024-01-29 12:09:53+00:00,Quarto,0.98969764
Camas boas,1,2025-01-19 00:00:00+00:00,Quarto,0.98064965
Já ficamos anteriormente neste hotel e fomos bem atendidos na ocasião.,1,2024-11-04 00:00:00+00:00,Atendimento da equipe,0.8469251
Funcionários muito atenciosos.,1,2025-05-05 00:00:00+00:00,Atendimento da equipe,0.9782037
"Desde o inicio o atendimento foi muito bom, principalmente  com a Samara, que esclareceu nossas dúvidas e nos auxiliou com a reserva.",1,2025-01-13 00:00:00+00:00,Atendimento da equipe,0.9601551
"Recepção todos muito amáveis e explicando tudo que se deve saber sobre o hotel, desde o apartamento, estacionamento, lazer e sugestões de turismo.",1,2025-05-01 00:00:00+00:00,Atendimento da equipe,0.9548474
"O atendimento é excelente, fiz minha reserva on-line com o atendente Erlon que foi muito atencioso e explicou tudo muito bem, inclusive dando dicas sobre passeios e restaurantes.",1,2025-01-15 00:00:00+00:00,Atendimento da equipe,0.9855877
tive um atendimento muito acolhedor e especial da Mariana e Cleberson que fizeram nesse dia mais suave o meu dia.,1,2024-12-06 00:00:00+00:00,Atendimento da equipe,0.99334866
"Seu profissionalismo fez toda a diferença, e fiquei muito satisfeito com o suporte que ela me deu.",1,2024-11-27 00:00:00+00:00,Atendimento da equipe,0.9889144
a camareira Daniela deixou toalhas muito fofas e limpas tudo organizado,1,2025-06-16 00:00:00+00:00,Atendimento da equipe,0.995379
chuveiro quente,1,2025-06-27 00:00:00+00:00,Banheiro,0.54514766
Quarto bem limpo,1,2025-01-18 00:00:00+00:00,Quarto,0.72721386
"Quarto, limpeza, café da manhã e atendimento foi muito bom.",1,2024-12-05 00:00:00+00:00,Quarto,0.98669124
cama confortável,1,2024-12-22 00:00:00+00:00,Quarto,0.66776067
Hotel top é a quarta vez que irei me hospedar lá .,1,2025-05-23 00:00:00+00:00,Experiência,0.9447951
a piscina também é muito boa e água quente e fria,1,2024-10-08 03:43:19+00:00,Áreas comuns,0.96784514
serviço das camareiras excelente,1,2025-01-18 00:00:00+00:00,Atendimento da equipe,0.939148
Experiência  agradável,1,2025-06-30 00:00:00+00:00,Experiência,0.93716735
funcionários do setor piscina Clebeson Santos e Amarildo,1,2025-05-10 00:00:00+00:00,Áreas comuns,0.44971907
"Café  da manhã  nem se fala, uma decoração  linda de Páscoa",1,2025-04-08 00:00:00+00:00,Café da manhã,0.99444926
café da manhã com bastante variedade,1,2024-07-09 09:38:13+00:00,Café da manhã,0.8826116
café da manhã bem variado,1,2025-02-19 00:00:00+00:00,Café da manhã,0.9732515
de baixo custo de transporte com carros de aplicativo,1,2025-05-03 00:00:00+00:00,Localização,0.59077066
Quarto sempre arrumado,1,2024-11-17 00:00:00+00:00,Quarto,0.037200272
quartos limpos,1,2024-12-23 00:00:00+00:00,Quarto,0.92115575
quero enfatizar da recepção o funcionário Pedro Dantas muito atencioso,1,2024-12-01 00:00:00+00:00,Atendimento da equipe,0.9777317
Fui atendido pelo colaborador Erlon e recebi um atendimento muito profissional e competente.,1,2025-04-06 00:00:00+00:00,Atendimento da equipe,0.9752422
Camas e roupas de cama super confortáveis e novas de excelente qualidade.,1,2024-04-27 01:25:21+00:00,Quarto,0.9608736
Happy hour com musica boa,1,2025-01-18 00:00:00+00:00,Experiência,0.9894484
higiene boa do quarto,1,2024-11-25 00:00:00+00:00,Quarto,0.4002952
gostaríamos de destacar a simpatia da funcionária Alba e o sabor dos pratos (risoto de camarão e salmao ao molho de frutas vermelhas),1,2025-06-24 00:00:00+00:00,Restaurante/Bar,0.7844489
São muito atenciosos em especial a camareira Dinalva muito querida deixou a gente super confortável e nos proporcionou tudo que precisavamos,1,2024-10-11 00:00:00+00:00,Atendimento da equipe,0.9898067
"Pegamos um Day Use com café da manhã, excelente custo benefício.",1,2025-03-05 22:28:11+00:00,Experiência,0.99255484
café da manhã gostoso,1,2025-07-02 00:00:00+00:00,Café da manhã,0.99399185
os travesseiros e lençóis são bem macios.,1,2025-03-29 00:00:00+00:00,Quarto,0.84544533
ambiente limpo,1,2025-02-02 00:00:00+00:00,Quarto,0.5444272
localização boa e perto do centro,1,2025-03-26 00:00:00+00:00,Localização,0.9188838
Nosso andar era atendido pela camareira Dinalva que era muito simpática!,1,2024-10-19 00:00:00+00:00,Atendimento da equipe,0.9885021
"o hotel tem uma localizacao boa, facilitou na chegada e na ida a outros passeios",1,2024-11-21 00:00:00+00:00,Localização,0.9765235
"Aplausos para a camareira Daniela, que salvou o hotel na cordialidade e bons serviços",1,2025-01-01 00:00:00+00:00,Atendimento da equipe,0.98689276
Preço honesto p hotel bom,1,2025-04-20 00:00:00+00:00,Experiência,0.98957986
"Direcionou ao que eu realmente precisava para minha estadia, ofereceu opções sobre quartos, alimentação em passeios.",1,2025-02-11 00:00:00+00:00,Atendimento da equipe,0.8620657
Café da manhã espetacular,1,2025-06-06 00:00:00+00:00,Café da manhã,0.99168533
uma cama maravilha,1,2024-10-23 00:00:00+00:00,Quarto,0.9773616
"Lugar aconchegante muito versátil amplo , arejado",1,2024-12-05 00:00:00+00:00,Experiência,0.9944281
Gostaria de expressar minha gratidão pela atenção e dedicação que a Fabiola demonstrou ao me atender no setor de reservas.,1,2024-11-21 00:00:00+00:00,Atendimento da equipe,0.95867383
"contar com uma ótima infraestrutura, incluindo secador de cabelo, cofre, facilidades para cadeirantes, frigobar e uma TV com uma variedade de canais",1,2024-01-19 13:22:30+00:00,Quarto,0.6579293
Excelente atendimento.,1,2024-03-12 15:03:26+00:00,Atendimento da equipe,0.9416062
Gostaria de destacar o atendimento incrível que recebi da Arielly.,1,2024-11-27 00:00:00+00:00,Atendimento da equipe,0.98653704
café da manhã com várias opções e muito bem servido,1,2024-04-26 12:12:01+00:00,Café da manhã,0.9786333
Bem localizado,1,2024-02-17 00:19:18+00:00,Localização,0.957996
"Tive o.prazer de conhecer Dona Emilia, muito simpatica.",1,2024-05-01 21:48:31+00:00,Atendimento da equipe,0.9956271
Todos os integrantes da apresentação são extremamente simpáticos!,1,2024-11-30 00:00:00+00:00,Atendimento da equipe,0.98851174
"Espaço rooftop com piscina e jacuzzi muito legal, apesar da piscina ser pequena.",1,2024-03-14 16:17:49+00:00,Áreas comuns,0.99074537
Café da manhã excelente,1,2024-04-10 18:59:10+00:00,Café da manhã,0.98650736
"Sensacional, café da manhã incrível.",1,2025-01-11 00:00:00+00:00,Café da manhã,0.993682
Todos os pequenos problemas que tivemos foram solucionados.,1,2025-03-26 00:00:00+00:00,Atendimento da equipe,0.60364115
quartos silenciosos,1,2025-02-19 00:00:00+00:00,Quarto,0.8644203
fomos atendidos pela Fabíola que rapidamente nos auxiliou e resolveu nosso problema!,1,2024-12-04 00:00:00+00:00,Atendimento da equipe,0.8653493
Qto à localização também é  bom. No centro próximo a restaurantes.,1,2025-01-13 20:55:43+00:00,Localização,0.96809375
tudo muito limpo,1,2025-02-16 00:00:00+00:00,Quarto,0.96626055
"Limpeza impecável, nossa camareira Yuli muito prestativa, educada e agradou nossa filha todos os dias com as esculturas de toalha.",1,2024-08-30 20:43:26+00:00,Atendimento da equipe,0.9943181
Ah tem uma academia com equipamentos novos,1,2025-04-24 00:00:00+00:00,Áreas comuns,0.5206121
"Gostaria de destacar o trabalho incrível da camareira Helida, cuja simpatia e alegria tornaram minha experiência ainda mais especial.",1,2024-10-14 00:00:00+00:00,Atendimento da equipe,0.98995256
A piscina é top,1,2024-12-09 00:00:00+00:00,Áreas comuns,0.98414797
"equipe atenciosa , sempre pronta para ajudar",1,2025-02-11 00:00:00+00:00,Atendimento da equipe,0.99208456
boa academia,1,2025-03-02 00:00:00+00:00,Áreas comuns,0.9931997
"a senhora dona do hotel está sempre de olho em tudo, achei muito legal da parte dela como proprietária checar todos os detalhes do próprio hotel.",1,2025-03-11 00:00:00+00:00,Atendimento da equipe,0.99062634
"Hotel muito bom, superou minhas expectativas.",1,2024-04-23 01:06:59+00:00,Experiência,0.9761533
pessoal da recepção e camareira super simpáticos e prestativos,1,2024-11-21 00:00:00+00:00,Atendimento da equipe,0.97069955
café da manhã farto,1,2024-10-05 00:00:00+00:00,Café da manhã,0.015296432
Dona Marielis sempre uma fofa fazendo toalhas em formatos de animaizinhos ao sair do quarto,1,2024-01-27 23:15:06+00:00,Atendimento da equipe,0.99530286
Uma excelente estadia principalmente pela cordialidade dos funcionários em todos os setores.,1,2024-10-14 00:00:00+00:00,Atendimento da equipe,0.95699704
"tem área de jogos, academia funcional, piscina aquecida e uma vista lista da cidade.",1,2025-08-08 00:00:00+00:00,Áreas comuns,0.72305083
Atendimento excelente,1,2024-11-28 00:00:00+00:00,Atendimento da equipe,0.8593616
tudo muito limpo,1,2025-06-25 00:00:00+00:00,Quarto,0.96626055
um bar,1,2025-05-02 00:00:00+00:00,Áreas comuns,0.6248494
acadêmia,1,2024-12-15 11:08:52+00:00,Áreas comuns,0.50693226
Ótimo atendimento fui atendida pela Fabíola ela é maravilhosa super atenciosa nos atendeu com aptidão em tudo,1,2025-04-05 00:00:00+00:00,Atendimento da equipe,0.9925823
Os quartos são confortáveis,1,2025-05-09 00:00:00+00:00,Quarto,0.73493
"lugar incrível, aconchegante e repleto de coisas para fazer",1,2025-06-26 00:00:00+00:00,Experiência,0.98928726
academia,1,2025-06-27 00:00:00+00:00,Áreas comuns,0.5469914
"A atendente da reserva ,Fabiola, Uma pessoa muito gentil,uma pessoa incansável de dar as dúvidas",1,2025-07-25 00:00:00+00:00,Atendimento da equipe,0.993915
quarto confortável,1,2025-05-04 00:00:00+00:00,Quarto,0.77771056
piscina aquecida!!!,1,2025-03-23 00:00:00+00:00,Áreas comuns,0.9377714
café com inúmeras opções,1,2024-08-06 17:20:33+00:00,Café da manhã,0.64554995
Camareira Eliane super simpatica e cuidadosa com o apartamento e com a limpeza,1,2024-04-09 10:23:18+00:00,Atendimento da equipe,0.9950206
Os quartos são confortáveis,1,2025-05-09 00:00:00+00:00,Quarto,0.73493
"funcionários gentis, sobretudo os do buffet",1,2025-05-31 00:00:00+00:00,Atendimento da equipe,0.5429695
"A Lauara, sempre deixando o quarto todo arrumado, com carinho e amor.",1,2024-01-31 12:27:05+00:00,Atendimento da equipe,0.99392134
A localização é muito boa.,1,2024-09-10 01:17:49+00:00,Localização,0.9912031
"A camareira Heidimar (responsável pelo nosso quarto) fez super bem o seu trabalho, deixando limpíssimo o quarto!",1,2024-04-23 00:05:02+00:00,Atendimento da equipe,0.99301535
piscina limpa,1,2025-02-23 00:00:00+00:00,Áreas comuns,0.8939554
"localização incrível: perto do ponto de ônibus, mercado e ótimos restaurantes",1,2025-06-25 00:00:00+00:00,Localização,0.9930106
"tem uma ótima recepção, sala de jogo, piscina, hidromassagem e quartos de hotéis",1,2025-02-17 00:00:00+00:00,Áreas comuns,0.9912
"Localização excelente. Hotel fica muito bem localizado,perto de tudo.",1,2024-08-17 17:34:50+00:00,Localização,0.98801035
funcionários atenciosos e muito profissionais,1,2025-05-19 00:00:00+00:00,Atendimento da equipe,0.97080237
limpeza,1,2024-08-18 17:27:23+00:00,Quarto,0.4642028
conforto,1,2024-08-18 17:27:23+00:00,Quarto,0.5201343
É um local bem movimentado e não senti medo ao sair a noite.,1,2025-05-20 00:00:00+00:00,Localização,0.8476438
"Atendimento excelente, ótimo restaurante e equipe de atendimento da atendimento está de parabéns",1,2025-06-06 00:00:00+00:00,Atendimento da equipe,0.9906602
"Equipe preparada,atenciosa, educada,isso torna o diferencial do hotel.",1,2025-02-11 00:00:00+00:00,Atendimento da equipe,0.98467827
"O Erlon atendente  c quem fiz contato foi super atencioso, educado.",1,2025-01-15 00:00:00+00:00,Atendimento da equipe,0.99315023
Cama e travesseiros super confortaveis.,1,2024-08-17 17:34:50+00:00,Quarto,0.9598017
junto oferece também uma belíssima vista da cidade,1,2024-10-31 00:00:00+00:00,Experiência,0.9310061
recepção funcionários muito atenciosos,1,2024-10-09 00:00:00+00:00,Atendimento da equipe,0.86587256
limpo,1,2024-04-17 00:00:00+00:00,Quarto,0.5294736
O hotel conta com um salão maravilhoso,1,2025-01-17 00:00:00+00:00,Áreas comuns,0.96128315
Hotel boa localização.,1,2025-03-02 00:00:00+00:00,Localização,0.97780406
"Queria ressaltar sobre o carinho, capricho e atenção da dona Elsa na arrumação dos quartos, uma profissional excelente!",1,2024-05-27 15:44:46+00:00,Atendimento da equipe,0.9921113
Fizemos um trabalho com música para os clientes,1,2025-03-18 14:05:32+00:00,Experiência,0.6682356
cafe top com variedades de alimentos,1,2025-01-26 18:31:12+00:00,Café da manhã,0.75706524
"Proporcionou informações além do esperado,  muito úteis sobre a cidade e o país vizinho,   além das informações próprias do hotel.",1,2024-10-10 00:00:00+00:00,Atendimento da equipe,0.9801521
Rápido atendimento,1,2024-12-28 00:00:00+00:00,Atendimento da equipe,0.8362021
Quartos limpos e perfumados.,1,2024-10-20 00:00:00+00:00,Quarto,0.8318197
"Mostrou, esclareceu e nos ajudou a fazer a melhor escolha possível, muito bom!!!",1,2024-12-13 00:00:00+00:00,Restaurante/Bar,0.9923849
linda vista do 7. Andar,1,2025-06-06 00:00:00+00:00,Quarto,0.9879839
mas o espaço em si é muito bacana para relaxar depois dos passeios!!,1,2025-03-11 00:00:00+00:00,Áreas comuns,0.986224
parabéns taroba pela qualidade,1,2025-01-07 00:00:00+00:00,Experiência,0.9913577
Excelente atendimento. Atendente Fabíola foi excelente e me ajudou em todas as dúvidas no momento da reserva.,1,2025-03-08 00:00:00+00:00,Atendimento da equipe,0.94130355
"O quarto era confortável, bem limpo e equipado com tudo o que eu precisava.",1,2025-03-18 00:00:00+00:00,Quarto,0.9326981
Opção bem localizada em Foz.,1,2025-03-17 00:00:00+00:00,Localização,0.91922015
chuveiro água forte,1,2025-04-01 00:00:00+00:00,Banheiro,0.5386678
salão de lazer,1,2024-12-10 00:00:00+00:00,Áreas comuns,0.6053479
"Quero deixar aqui meu elogio a todos os funcionários da hotel Tarobá ,em especial a camareira Dinalva , muito educada e carinhosa .",1,2024-10-10 00:00:00+00:00,Atendimento da equipe,0.99360836
Tudo no restaurante é muito bom,1,2024-12-19 00:00:00+00:00,Restaurante/Bar,0.9883008
"A camareira Lariza que nos atendeu, deixou tudo muito bem organizado e limpo durante a nossa hospedagem",1,2024-12-03 00:00:00+00:00,Atendimento da equipe,0.95236266
café da manhã maravilhoso,1,2024-12-14 00:00:00+00:00,Café da manhã,0.98931724
Limpeza impecável.,1,2024-10-19 13:13:36+00:00,Quarto,0.97726774
Ótimo atendimento.,1,2025-02-10 00:00:00+00:00,Atendimento da equipe,0.98059434
preços ótimos,1,2025-06-27 00:00:00+00:00,Restaurante/Bar,0.9419073
"Nossa camareira, Daniela, sempre prestativa, atenciosa com nossas necessidades.",1,2025-04-21 00:00:00+00:00,Atendimento da equipe,0.9929957
a camareira Lourdes deixou na chegada as boas vindas e se disponibilizando para o que necessitasse,1,2024-12-28 00:00:00+00:00,Atendimento da equipe,0.93722224
O café da manhã é maravilhoso.Tem de tudo.,1,2025-03-29 00:00:00+00:00,Café da manhã,0.9910311
área de lazer,1,2024-08-06 17:20:33+00:00,Áreas comuns,0.49852195
espaçoso,1,2024-12-10 00:00:00+00:00,Quarto,0.96273834
Toalhas limpas todos os dias.,1,2025-02-14 00:00:00+00:00,Banheiro,0.5818811
Vale muito apena ótimo custo para um estádia maravilhosa,1,2024-05-27 01:14:04+00:00,Experiência,0.9884883
muito confortável,1,2024-03-03 00:00:00+00:00,Quarto,0.8094745
Experiência incrível.,1,2025-04-16 00:00:00+00:00,Experiência,0.9822784
trabalhadores simpáticos,1,2025-01-04 00:00:00+00:00,Atendimento da equipe,0.84701884
um bar,1,2025-05-02 00:00:00+00:00,Áreas comuns,0.6248494
toalhas de boa qualidade,1,2025-06-06 00:00:00+00:00,Banheiro,0.9257415
CUSTO BENEFICIO. UM EXCELENTE CUSTO BENEFICIO,1,2025-05-10 00:00:00+00:00,Experiência,0.9916565
Ótimo custo benefício. Hotel com ótimo custo benefício.,1,2025-04-28 00:00:00+00:00,Experiência,0.9899305
excelente café da manhã,1,2025-06-29 00:00:00+00:00,Café da manhã,0.9888281
Quartos confortáveis,1,2025-02-24 00:00:00+00:00,Quarto,0.8346721
Quarto aconchegante e novo,1,2025-07-25 00:00:00+00:00,Quarto,0.9894842
tudo uma delícia,1,2025-06-30 00:00:00+00:00,Restaurante/Bar,0.9916071
Resolveu meu problema muito rápido,1,2025-01-06 00:00:00+00:00,Atendimento da equipe,0.9687929
"No restaurante, o atendimento do garçon Leandro foi excelente, muito atencioso, nota 10!!!",1,2024-12-13 00:00:00+00:00,Restaurante/Bar,0.9902791
Rápido atendimento.,1,2025-01-17 00:00:00+00:00,Atendimento da equipe,0.96286166
"Tudo muito organizado, desde a limpeza até o cafe da manhã",1,2025-02-17 00:00:00+00:00,Quarto,0.9196316
"Preço muito bom , reservei via booking.",1,2024-11-26 00:00:00+00:00,Experiência,0.9916065
Na recepção já ficamos sabendo dos melhores pontos turísticos,1,2025-06-26 00:00:00+00:00,Localização,0.7229337
Restaurante  com porções deliciosas,1,2024-12-06 00:00:00+00:00,Restaurante/Bar,0.9838082
"Foi incrível! O hotel é lindo e super organizado, amamos a estadia",1,2024-03-30 00:36:50+00:00,Experiência,0.9914485
Hotel e bem localizado no centro da cidade proporcionando uma ótima mobilidade a pontos turísticos.,1,2024-10-25 00:00:00+00:00,Localização,0.931014
O lugar possui ótimo ambiente para descanso,1,2024-12-10 00:00:00+00:00,Experiência,0.9633633
a camareira Yuri muito eficiente na sua função sempre muito prestativa e atenciosa com os hospedes,1,2024-10-14 00:00:00+00:00,Atendimento da equipe,0.9898581
atendentes super atenciosos e prestativos nas dicas para os turistas,1,2024-10-23 00:00:00+00:00,Atendimento da equipe,0.9777371
café da manhã incrível,1,2025-04-04 00:00:00+00:00,Café da manhã,0.9848389
As piscinas ótima,1,2025-05-09 00:00:00+00:00,Áreas comuns,0.9845223
Excelente atendimento. Atendente Fabíola foi excelente e me ajudou em todas as dúvidas no momento da reserva.,1,2025-03-08 00:00:00+00:00,Atendimento da equipe,0.94130355
Cidade maravilhosa com pontos turísticos lindos.,1,2025-05-19 00:00:00+00:00,Localização,0.9887852
equipe operacional muito prestativa e atenciosa,1,2024-04-13 20:26:36+00:00,Atendimento da equipe,0.9001874
pontos turísticos próximos,1,2024-12-15 00:00:00+00:00,Localização,0.5474225
O quarto bem espaçoso,1,2024-12-27 00:00:00+00:00,Quarto,0.66838163
"Atendimento muito especial, muito atencioso. Totalmente educada a atendente Arielle",1,2025-01-06 00:00:00+00:00,Atendimento da equipe,0.9934563
"Ótima localização, com excelentes atrativos.",1,2024-11-30 00:00:00+00:00,Localização,0.9917819
o café da manhã é ótimo,1,2025-03-06 00:00:00+00:00,Café da manhã,0.9883544
"Hotel aconchegante, gostoso café da manhã.",1,2024-02-26 20:32:44+00:00,Experiência,0.99308735
A experiência com relação ao atendimento foi de forma muito cordial a atendente Fabíola foi formidável ágil e cordial na abordagem e solução de alguns impasses com relação a reserva.,1,2025-06-13 00:00:00+00:00,Atendimento da equipe,0.924069
boa seleção de pratos,1,2025-06-29 00:00:00+00:00,Café da manhã,0.93248224
banheiro no tamanho excelente,1,2024-12-20 00:00:00+00:00,Banheiro,0.98377186
o café da manhã e a área da piscina são excelentes,1,2024-12-19 00:00:00+00:00,Áreas comuns,0.9881919
"Ótimo atendimento na reserva  efetuada pela Fabíola, que nos atendeu super bem, tanto via telefone como via Whatsapp.",1,2024-11-04 00:00:00+00:00,Atendimento da equipe,0.9819769
Destaco a última experiência ao atendimento prestado pela Mariana no canal whatsapp para os pedidos do restaurante.,1,2025-02-13 00:00:00+00:00,Atendimento da equipe,0.9913945
Piscina bem quente,1,2025-07-12 00:00:00+00:00,Áreas comuns,0.62175053
"Gostei muito do atendimento do sr. Erlon. Foi atencioso, gentil, tirou as dúvidas e fez um bom pacote pra gente.",1,2024-11-29 00:00:00+00:00,Atendimento da equipe,0.9929912
Os quartos são limpos,1,2025-03-02 00:00:00+00:00,Quarto,0.66474867
"Fui atendida pela colaboradora Arielly, prestativa, atenciosa e simpática, atendeu-me muito bem na hora da reserva",1,2024-12-11 00:00:00+00:00,Atendimento da equipe,0.9547483
"Gostaria de destacar o bom trabalho da camareira Daniela, que atende ao 5° andar, da torre 2, ela está de parabéns.",1,2025-04-03 21:06:20+00:00,Atendimento da equipe,0.9943908
Ótimo hotel e muito bons funcionários,1,2024-11-06 00:00:00+00:00,Atendimento da equipe,0.96959937
Fomos atendidos na recepção  pelo André Leme super atencioso  e prestativo com os clientes,1,2024-01-15 10:09:04+00:00,Atendimento da equipe,0.9859956
funcionários bem receptivos,1,2024-12-15 00:00:00+00:00,Atendimento da equipe,0.85922813
Limpeza excelente.,1,2024-09-28 00:00:00+00:00,Quarto,0.9934644
café da manhã muito bom,1,2025-03-11 00:00:00+00:00,Café da manhã,0.98670775
Realizei meu check-out com o Thiago que foi um fofo,1,2024-11-23 18:48:31+00:00,Atendimento da equipe,0.9947611
quero enfatizar da recepção o funcionário Pedro Dantas muito atencioso,1,2024-12-01 00:00:00+00:00,Atendimento da equipe,0.9777317
"Limpo, funcionários simpáticos e dispostos.",1,2025-01-08 00:00:00+00:00,Atendimento da equipe,0.98701215
"perto de tudo, farmácia, comércio em geral e bons restaurantes e padaria",1,2024-05-06 15:48:55+00:00,Localização,0.78754824
Ótimo custo benefício,1,2024-12-22 00:00:00+00:00,Experiência,0.9817143
