text,class,date,aspect,score
a piscina é bem pequena,0,2025-04-27 00:00:00+00:00,Áreas comuns,0.516456
"A mesa de doces estava ainda pior, doces quentes(feitos na hora e na correria) e sem o mínimo de sabor.",0,2024-01-01 03:28:47+00:00,Restaurante/Bar,0.01634689
"tentei falar no hotel para reaver  ao menos parte de minha diária mas o atendimento foi novamente intransigente e disseram que minha solicitação  não estava na "" política  do hotel""",0,2024-12-05 01:34:23+00:00,Atendimento da equipe,0.037413135
o hotel precisa ter mais organização,0,2025-03-02 00:25:47+00:00,Experiência,0.1944491
"Porém não tem garagem para todos os hóspedes, mesmo pagando a parte pela garagem, vou ter que deixar o carro na rua, pois não tem vagas no primeiro andar, nem no segundo e a recepcionista acha que nem no terceiro",0,2025-05-02 22:06:24+00:00,Áreas comuns,0.014941217
"Uma pena cobrarem o estacionamento, até pra carregar e descarregar as malas tive que fazer rapidamente pela rua , entrada do hotel. Antigamente era gratuito…",0,2025-07-03 00:00:00+00:00,Áreas comuns,0.010529077
"Não consegui subir meu veículo, desgastei meu pneu, arranhei o meu carro e colocaram um papel no vidro, dizendo que só carros grandes poderiam ficar no térreo, sendo que o estacionamento tem custo de 25 a diária",0,2025-07-14 01:13:56+00:00,Áreas comuns,0.023466785
"só fica a desejar um pouco de atenção com os hospedes, pois não tive esta boa relação",0,2025-06-17 14:38:51+00:00,Atendimento da equipe,0.017323896
Detalhe: a dona circula no salao do cafe da manhã o tempo todo e ainda nao percebeu o quanto é desagradável ter que ficar pedindo um simples sachê de chá?,0,2024-01-27 00:00:00+00:00,Café da manhã,0.018130805
"Ponto alto da noite foi o garçom tirando um rechaud de chocolate que estava fritando a 15 minutos numa mesa do lado e ele ESTOURANDO NA MÃO DO GARÇON ,caindo quase no rosto dele, voando chocolate quente pelo salão inteiro",0,2025-07-15 15:12:43+00:00,Restaurante/Bar,0.056805238
box com lodo,0,2024-08-13 11:37:46+00:00,Banheiro,0.6235431
o terraço com as piscinas não é bom. São pequenas e de difícil acesso para quem tem alguma dificuldade motora (escadas).,0,2025-03-09 00:00:00+00:00,Áreas comuns,0.017728385
Frios de péssima qualidade..,0,2024-01-04 03:13:04+00:00,Café da manhã,0.012115569
Na sexta não passaram limpar o quarto,0,2025-06-22 12:55:05+00:00,Atendimento da equipe,0.14178327
música alta de noite no rooftop do hotel,0,2025-04-26 00:40:05+00:00,Experiência,0.35235637
"O pior quarto, barulho de turbina no quarto.",0,2024-06-18 21:33:39+00:00,Quarto,0.011789181
o colchão muito mole,0,2025-06-01 00:00:00+00:00,Quarto,0.014735223
Chuveiro HORRIVÈL,0,2025-06-12 08:34:42+00:00,Banheiro,0.4078791
A única coisa que diria foi complicada é que a faxina diria não envolve algo mais caprichado.,0,2025-01-26 00:00:00+00:00,Quarto,0.1326286
o quarto que fiquei tinha algum barulho de maquinário fora que me incomodava pra dormir,0,2024-03-29 12:13:35+00:00,Quarto,0.015269968
"massa de bolo seca, parece “bolo pronto” de mercado",0,2025-07-12 00:00:00+00:00,Café da manhã,0.9008638
a limpeza dessa vez deixou a desejar,0,2024-04-21 00:00:00+00:00,Quarto,0.03331569
Faltou estacionamento grátis kkkk,0,2025-01-20 00:00:00+00:00,Áreas comuns,0.011890274
estacionamento ao lado do hotel com cobrança de diária,0,2025-02-23 00:00:00+00:00,Áreas comuns,0.47917944
Não digo o mesmo para a recepção.,0,2024-06-25 12:39:17+00:00,Atendimento da equipe,0.21080038
Únicas coisas a melhorar é o estacionamento que entendo estar em reforma,0,2024-11-21 00:00:00+00:00,Áreas comuns,0.38597372
"a cama de casal do quarto eram duas camas juntadas, o que significa que dormir no meio da cama não era possível, pois sentíamos a divisão da cama",0,2025-06-22 12:55:05+00:00,Quarto,0.14665474
"Os colaboradores da Combo Iguassu a mesma coisa, quando passamos sempre com o semblante fechado, conversando entre eles ou ficados nos monitores",0,2025-03-25 00:00:00+00:00,Atendimento da equipe,0.13733105
recepção com apenas 2 pessoas para fazer Check-in mesmo com grupo de 45 pessoas agendado. Mais de 2h depois e não haviam lançado o meu Check-in,0,2025-06-20 00:00:00+00:00,Atendimento da equipe,0.017018447
"Primeira noite a porta do quarto nao fechava, e mesmo reclamando 3 vezes, tive que sair a rua e dormir com ela sem trancar, somente no outro dia apos a 4 reclamação foram arrumar a porta.",0,2025-01-10 00:00:00+00:00,Quarto,0.029178333
só os sucos que são artificiais,0,2024-02-02 13:30:22+00:00,Café da manhã,0.364299
A cama estava com a mola quebrada,0,2025-07-19 02:58:16+00:00,Quarto,0.01580973
"Um dos dias, iríamos utilizar a toalha que estava disponível no quarto, porém, estava suja",0,2024-01-14 19:59:39+00:00,Quarto,0.3830768
O atendimento na recepção é ruim.,0,2024-06-09 11:42:39+00:00,Atendimento da equipe,0.018344058
a água não esquentava o suficiente diz minha esposa,0,2025-02-13 00:00:00+00:00,Banheiro,0.017674094
Café da manhã bem fraco,0,2024-02-22 00:00:00+00:00,Café da manhã,0.066813126
os banheiros da área externa não estavam tao limpos,0,2025-01-20 00:00:00+00:00,Banheiro,0.057801336
Chuveiro HORRIVÈL,0,2025-06-12 08:34:42+00:00,Banheiro,0.4078791
mas tivemos de pedir para limpar a mesa que estávamos (muito provavelmente pelo fluxo de pessoas),0,2025-02-23 00:00:00+00:00,Café da manhã,0.07080199
"O foundue, não conseguem manter a temperatura adequada para uma boa experiência e alguns itens não tem compatibilidade.",0,2025-06-04 00:00:00+00:00,Restaurante/Bar,0.015530439
Agua do chuveiro é fria,0,2025-06-22 12:55:05+00:00,Banheiro,0.16174568
a academia toda quebrada,0,2024-04-29 00:00:00+00:00,Áreas comuns,0.0136036
Demorou 40 minutos para “fazer a caipirinha” enquanto esperávamos no sol,0,2024-11-17 18:33:07+00:00,Restaurante/Bar,0.54411757
MUITO NEGATIVO E ESTACIONAMENTO,0,2025-01-17 00:00:00+00:00,Áreas comuns,0.031122701
"O único de bom que tem são as frutas e cereais, mas a variedade é escassa.",0,2024-04-30 16:55:31+00:00,Café da manhã,0.025738645
"Café da manhã bem servido e variado, mas pão de queijo quase sempre duro.",0,2025-04-22 16:01:07+00:00,Café da manhã,0.2396348
"nosso quarto era do lado do elevador, tinha muito barulho quando outros hóspedes usavam o que atrapalha muito o sono de quem quer dormir mais tempo",0,2024-12-23 00:02:39+00:00,Quarto,0.013278129
"Um dos pontos que mais me incomodou foi o tamanho do quarto de casal, que achei pequeno, especialmente considerando que a reserva era para uma categoria ""superior"".",0,2025-06-05 18:23:39+00:00,Quarto,0.04007336
o suco de laranja e uva deveria ser natural,0,2024-05-02 02:00:18+00:00,Café da manhã,0.4843463
mas acontece o mesmo,0,2024-01-05 18:56:09+00:00,Áreas comuns,0.34663773
a metre perguntando se tava tudo bem na mesa e eu falei que não não estava nada bem não tinha nada certo comecei a informar para ela tudo que aconteceu e aí ela simplesmente virou para mim e falou que estavam em teste que o Rechaud não estava acendendo e ele estava usando aquela vela que apesar de saberem que não tava esquentando era uma opção que ele tinha ele.,0,2025-07-15 15:12:43+00:00,Atendimento da equipe,0.15314712
com barulho de máquina de ar condicionado vibrando,0,2025-01-20 09:39:27+00:00,Quarto,0.08904497
"Primeiro que ao chegar, eles passaram o ramal para ligar, chegando no quarto não tinha telefone.",0,2024-12-07 21:37:10+00:00,Quarto,0.38657582
fios de cabelos pelas paredes,0,2024-08-13 11:37:46+00:00,Banheiro,0.49324793
Não há tratamento acústico,0,2025-05-19 00:00:00+00:00,Quarto,0.43033308
fui mal atendido,0,2025-03-02 00:25:47+00:00,Atendimento da equipe,0.0430304
Fiquei +1h30 esperando atendimento na área da piscina e ninguém aparecia,0,2024-04-27 19:28:08+00:00,Atendimento da equipe,0.027781002
"estacionamento com divergência, e horrível para subir com veículo",0,2025-03-15 00:00:00+00:00,Áreas comuns,0.012583486
Ficaria bem melhor se o estacionamento fosse cortezia o que tornaria um diferencial só hotel,0,2024-10-14 00:00:00+00:00,Áreas comuns,0.31955513
Achei a suíte muito apertada,0,2025-03-22 00:00:00+00:00,Quarto,0.01694337
tinha vazamento no banheiro,0,2025-07-14 01:13:56+00:00,Banheiro,0.3485492
"Música alta no bar do lado, o corredor cheirava a churrasco na noite da música alta do bar, creio se tratar de uma churrascaria.",0,2025-05-19 00:00:00+00:00,Áreas comuns,0.06590265
apartamentos ... pequeno,0,2025-01-18 00:00:00+00:00,Quarto,0.8196288
em um dos dias teve refluxo do dreno e começou a pingar,0,2024-12-18 00:00:00+00:00,Quarto,0.20134343
"optei por meia pensão, mas fiquei muito decepcionado com as opções oferecidas no jantar: apenas três pratos disponíveis, repetidos todos os dias",0,2024-12-22 00:59:57+00:00,Restaurante/Bar,0.024029162
Lugar barulhento com Obra no andar,0,2025-06-12 08:34:42+00:00,Quarto,0.9354384
"A água do chuveiro era pouco, até que no segundo dia, acabou e não saía mais.",0,2024-12-07 21:37:10+00:00,Banheiro,0.06359372
"As piscinas fui frustrante não funcionava muito sujas reclamei na recepção me encaminharam para ouvidoria fui atendida, porém não resolveram nada continuou suja.",0,2025-01-26 23:00:55+00:00,Áreas comuns,0.0106881
Pecou apenas pelo colchão (afunda),0,2024-09-12 04:17:05+00:00,Quarto,0.015953328
"Minha toalha está melada de sangue que nao é meu, melhorar a higiene",0,2025-07-01 00:00:00+00:00,Banheiro,0.009744199
o banheiro fede a esgoto,0,2025-07-15 00:00:00+00:00,Banheiro,0.32722765
"No check-in (demorado) não encontram nossas reservas pagas nos fazendo apresentar os comprovantes de pagamentos já realizados desde o ano passado e assim liberando nossa entrada ""provisória "" até checagem no dia posterior!",0,2024-02-22 19:20:13+00:00,Atendimento da equipe,0.03700334
O estacionamento esta em obras eles abriram já pra usar,0,2024-11-12 23:13:59+00:00,Áreas comuns,0.5014652
a água quente acaba e a previsão de retorno não ocorre e o pior são os atendentes dizendo que da pra tomar banho porque está razoavelmente quente impossível,0,2025-01-16 00:00:00+00:00,Banheiro,0.014548502
está saindo suja,0,2024-01-22 02:18:48+00:00,Banheiro,0.028481353
"O estacionamento que antes era cortesia agora é cobrado 25,00 reais por dia",0,2025-06-16 19:41:29+00:00,Áreas comuns,0.39944172
Falta apenas incluírem cerveja sem glúten no cardápio.,0,2025-01-07 15:07:10+00:00,Restaurante/Bar,0.21010806
O ralo do banheiro subia um cheiro de esgoto.,0,2025-01-01 22:37:18+00:00,Banheiro,0.04460605
"a cama de casal do quarto eram duas camas juntadas, o que significa que dormir no meio da cama não era possível, pois sentíamos a divisão da cama",0,2025-06-22 12:55:05+00:00,Quarto,0.14665474
mas acontece o mesmo,0,2024-01-05 18:56:09+00:00,Áreas comuns,0.34663773
"A única observação é em relação ao atendimento na recepção, que poderia ser mais acolhedor e atencioso.",0,2025-07-20 21:01:08+00:00,Atendimento da equipe,0.54970783
"A acústica é ruim então tinha barulho das 6 da manhã à meia noite, além do elevador fazer um som de batida toda vez que para num andar.",0,2024-10-22 00:00:00+00:00,Quarto,0.0105261905
manchas de sei lá o que no piso e azulejo,0,2025-05-05 00:00:00+00:00,Quarto,0.0113018025
Acomodação extremamente pequena,0,2025-01-20 09:39:27+00:00,Quarto,0.10819397
fui tratado na recepção como mentiroso por uma atendente que não tem empatia nenhuma com os clientes!,0,2025-01-26 18:31:12+00:00,Atendimento da equipe,0.014042294
o banheiro não havia sido limpo,0,2024-01-17 11:39:56+00:00,Banheiro,0.055882204
"O estacionamento está em obras com a rampa ainda em construção, com escoras no concreto, rampa extremamente inclinada",0,2025-07-14 01:13:56+00:00,Áreas comuns,0.51204187
Restaurante não serve um suco da fruta,0,2024-02-22 00:00:00+00:00,Restaurante/Bar,0.018780971
infelizmente peca no suco de laranja que é integral,0,2025-02-15 00:00:00+00:00,Café da manhã,0.011761875
"Estacionamento péssimo, abandonado.",0,2024-06-09 11:42:39+00:00,Áreas comuns,0.012849979
"trata-se de um bar próximo a recepção do hotel com espaço pequeno e repleto de mesas para duas pessoas do tipo arredondada que para utilizar com mais convidados, se faz necessário juntá-las, o que fica igualmente ruim já que são pequenas demais.",0,2025-06-05 01:11:23+00:00,Restaurante/Bar,0.028545639
"não há isolamento acústico, muito barulho ao tentar cochilar durante o dia",0,2025-03-21 00:00:00+00:00,Quarto,0.021998692
"atendimento seco, muitas vezes nem bom dia você recebe, salvo, algumas exceções",0,2025-02-25 00:00:00+00:00,Atendimento da equipe,0.013527681
O chuveiro também demorava muito para esquentar (5 minutos nao era exagero) e la se iam centenas de Litros de água desperdiçadas,0,2025-03-22 00:31:14+00:00,Banheiro,0.010075305
Pelo tamanho do hotel achei a quantidade de elevadores insuficiente,0,2024-12-20 00:00:00+00:00,Áreas comuns,0.07665365
Únicas coisas a melhorar é o estacionamento que entendo estar em reforma,0,2024-11-21 00:00:00+00:00,Áreas comuns,0.38597372
"Fora isso, e o calor nos elevadores e corredores, estava tudo ok!",0,2024-12-05 00:00:00+00:00,Áreas comuns,0.9905903
ar com problema quase toda estadia,0,2025-03-26 14:04:53+00:00,Quarto,0.01377313
Toalhas velhas.,0,2024-01-27 00:00:00+00:00,Quarto,0.76935834
Não digo o mesmo para a recepção.,0,2024-06-25 12:39:17+00:00,Atendimento da equipe,0.21080038
"Ao indagar sobre as promoções do Instagram, fomos tratados com descaso e informaram que podem ser canceladas e que eles não tem a obrigação de substituir.",0,2025-05-22 00:00:00+00:00,Atendimento da equipe,0.03737467
Agua do chuveiro é fria,0,2025-06-22 12:55:05+00:00,Banheiro,0.16174568
"a camareira tocou 2x a campainha perguntando se eu não iria querer a limpeza, sendo que nesse intervalo que fiquei fora seria o suficiente para que a mesma realizasse",0,2025-06-16 19:41:29+00:00,Atendimento da equipe,0.40335166
"Os funcionários de maneira geral foram bem educados e atenciosos, exceto a auto-intitulada ""Gerente Tassyla"" que nos tratou de forma bastante inadequada.",0,2025-03-05 00:00:00+00:00,Atendimento da equipe,0.014081398
"Não gostei muito da comida servida no restaurante. No caso, a carne veio totalmente mal passada",0,2024-02-14 15:01:30+00:00,Restaurante/Bar,0.013326145
Uma.pena não ter lugar pra estacionar o ônibus,0,2024-01-17 21:37:27+00:00,Áreas comuns,0.010229755
o estacionamento é ruim e está em obras,0,2025-01-18 00:00:00+00:00,Áreas comuns,0.018016174
Lugar barulhento com Obra no andar,0,2025-06-12 08:34:42+00:00,Quarto,0.9354384
"o menu de drinks é bem pequeno e os destilados são de segunda linha,N tinha importados nem destilados de melhor qualidade",0,2025-07-09 19:19:58+00:00,Restaurante/Bar,0.033565756
A cama não era muito confortável.,0,2024-03-14 16:17:49+00:00,Quarto,0.06054867
recepção com apenas 2 pessoas para fazer Check-in mesmo com grupo de 45 pessoas agendado. Mais de 2h depois e não haviam lançado o meu Check-in,0,2025-06-20 00:00:00+00:00,Atendimento da equipe,0.017018447
Frios de péssima qualidade..,0,2024-01-04 03:13:04+00:00,Café da manhã,0.012115569
apartamento pouco pequeno,0,2025-04-25 00:00:00+00:00,Quarto,0.45446253
"Porém não tem garagem para todos os hóspedes, mesmo pagando a parte pela garagem, vou ter que deixar o carro na rua, pois não tem vagas no primeiro andar, nem no segundo e a recepcionista acha que nem no terceiro",0,2025-05-02 22:06:24+00:00,Áreas comuns,0.014941217
"Detalhe o estacionamento é pago, R$ 25,00 por dia.",0,2024-12-05 00:00:00+00:00,Áreas comuns,0.4627369
muitas coisas que peguei não achei gostoso,0,2025-04-27 00:00:00+00:00,Café da manhã,0.03142906
"Falamos com a proprietária do hotel, que prometeu uma solução e resolução do caso, porém sem sucesso",0,2025-03-08 23:36:12+00:00,Atendimento da equipe,0.20033075
"quando pedi p me colocarem no quarto de categoria certa disseram q não tinha mais disponível, bem confuso",0,2025-07-15 00:00:00+00:00,Atendimento da equipe,0.012485366
"E as frutas cortadas como banana, e maçã. Achei que não fica algo fresco. Precisa melhorar.",0,2024-08-08 00:00:00+00:00,Café da manhã,0.011008934
"Mesmo após apresentar minhas reclamações, os funcionários mostraram-se incapazes de oferecer qualquer solução ou melhoria",0,2024-12-22 00:59:57+00:00,Atendimento da equipe,0.017514259
a limpeza muito mal feita,0,2025-01-04 15:52:07+00:00,Quarto,0.015298078
Só achei o quarto um pouco pequeno !,0,2025-02-14 00:00:00+00:00,Quarto,0.028855514
"o estacionamento apesar de pago R$ 25,00 por 24 horas) foi um transtorno pois nunca conseguiamos entrar ou sair sem acionar a recpeção que tinha que ir de forma aborrecida no totem nos liberar",0,2025-01-16 13:40:46+00:00,Áreas comuns,0.0112977745
A equipe na recepção não tem nenhum preparo.,0,2024-12-28 00:00:00+00:00,Atendimento da equipe,0.01843397
"Porém não tem garagem para todos os hóspedes, mesmo pagando a parte pela garagem, vou ter que deixar o carro na rua, pois não tem vagas no primeiro andar, nem no segundo e a recepcionista acha que nem no terceiro",0,2025-05-02 22:06:24+00:00,Áreas comuns,0.014941217
Não digo o mesmo para a recepção.,0,2024-06-25 12:39:17+00:00,Atendimento da equipe,0.21080038
Comida do restaurante com custo benefício baixo.,0,2024-01-30 23:33:07+00:00,Restaurante/Bar,0.044792194
"A única observação é em relação ao atendimento na recepção, que poderia ser mais acolhedor e atencioso.",0,2025-07-20 21:01:08+00:00,Atendimento da equipe,0.54970783
Demorou 40 minutos para “fazer a caipirinha” enquanto esperávamos no sol,0,2024-11-17 18:33:07+00:00,Restaurante/Bar,0.54411757
"O estacionamento é cobrado como se fosse um shopping mas é péssimo, perigoso e sem segurança.",0,2025-06-20 00:00:00+00:00,Áreas comuns,0.011893193
Pagamos pela ceia de ano novo e foi simplesmente péssima.,0,2024-01-01 03:28:47+00:00,Restaurante/Bar,0.010490581
para entrar de carro no hotel você terá que passar no MEIO de uma obra,0,2025-02-07 00:12:10+00:00,Áreas comuns,0.25566247
o isolamento acústico não é muito eficiente,0,2025-02-15 00:00:00+00:00,Quarto,0.0539795
A rampa do estacionamento muito ruim,0,2025-01-23 00:00:00+00:00,Áreas comuns,0.013247658
Pagamos pela ceia de ano novo e foi simplesmente péssima.,0,2024-01-01 03:28:47+00:00,Restaurante/Bar,0.010490581
"o barulho semelhante a um motor, incessante, estava me deixando estressada",0,2025-01-01 00:00:00+00:00,Quarto,0.020877963
"O estacionamento é horrível, tanto em área de manobra, quanto no sistema de controle da cancela que bloqueia o seu ticket a cada entrada/saída",0,2025-01-20 09:39:27+00:00,Áreas comuns,0.010013395
no elevador ninguém entra e cumprimenta,0,2024-04-25 12:46:17+00:00,Áreas comuns,0.04246986
O banheiro estava e vai ficar cheirando esgoto ! Pois o ralo banheiro está com defeito,0,2025-01-25 00:00:00+00:00,Banheiro,0.010544558
"MAS, infelizmente, ficamos no 6º andar, um antes do salão de café da manhã e jantar, e o dormimos MUITO mal todas as noites. Era barulho de arrumação de mesas e cadeiras, buffets e afins até 00h00 todos os dias, e começavam as 4h30!!! Um dia teve evento no rooftop fechado para convidados, com banda ao vivo até pouco depois das 22h (isso que nosso quarto era virado pro lado oposto da piscina e rooftop) e estava alto. No mesmo dia, acabou a banda e começou dança árabe que foi quase até meia-noite também. Enfim, dormimos mal, a bebê idem.",0,2025-04-22 16:01:07+00:00,Quarto,0.014542138
No banheiro disponibilizam shampoo e sabonete de péssima qualidade.,0,2024-02-28 10:44:11+00:00,Banheiro,0.018519362
Atendimento recepção ruim.,0,2025-03-08 00:00:00+00:00,Atendimento da equipe,0.020891218
"Quarto extremamente barulhento, tenho um sono pesado e mesmo assim o barulho atrapalhou nossa estadia",0,2025-02-07 00:12:10+00:00,Quarto,0.011436837
bonito e com muitos itens porém não me agradaram em sabor ao ponto que não tomei mais cafe da manhã no hotel,0,2025-07-23 00:00:00+00:00,Café da manhã,0.15029573
elevador quebrou 2 vezes em 5 dias,0,2024-07-23 16:42:45+00:00,Áreas comuns,0.04175726
"Estacionamento péssimo, sem cobertura e apertado. R$ 25,00 a diária.",0,2025-01-04 15:52:07+00:00,Áreas comuns,0.009595584
"Os elevadores são lentos e insuficientes, o que faz você perder 5 minutos facilmente aguardando pelo mesmo",0,2025-01-20 09:39:27+00:00,Áreas comuns,0.011649107
"novamente apenas o edredom de solteiro , liguei na recepção para resolver , demoraram mais de 20 minutos para trazer e ainda trouxeram um edredom de solteiro",0,2025-04-30 05:48:26+00:00,Quarto,0.040565096
Hotel sem acústico.. corredores sem isolamento acustico,0,2025-03-19 00:00:00+00:00,Quarto,0.26861447
"eu escutei a seguinte frase da chefe da recepção : ""vocês não podem me culpar por uma coisa que não aconteceu no meu turno"" ... ou seja, o hotel não é uma empresa como um todo, se o problema aconteceu com a equipe do turno noturno, a equipe do turno diurno não tem nenhuma ""responsabilidade por NADA"" ... e ela ainda se disse a ""responsável pela recepção"" ...",0,2024-12-30 10:30:04+00:00,Atendimento da equipe,0.015466565
Poderia melhorar os sucos fornecidos no café da manhã,0,2025-08-10 00:00:00+00:00,Café da manhã,0.4173943
havia apenas um edredom de solteiro para um casal,0,2025-04-30 05:48:26+00:00,Quarto,0.53152347
Pedi que em qualquer urgência me avisassem e me avisaram após o carro ser multado por parar em local proibido sendo que foi o próprio Hotel que orientou e falou que não haveria problema.,0,2024-07-18 15:17:30+00:00,Atendimento da equipe,0.20882142
"certamente o valor pago de R$244,86 foi muito caro comparado com o que estava disponível para se servir",0,2024-12-25 21:48:50+00:00,Restaurante/Bar,0.038847283
"Tudo muito bom, exceto o serviço de meia pensão do restaurante.",0,2025-02-10 00:00:00+00:00,Experiência,0.994422
"A limpeza dos quartos deixou muito a desejar. Praticamente não foi feita, o que é inaceitável para qualquer hotel que se proponha a oferecer um mínimo de conforto aos hóspedes.",0,2025-01-26 23:00:55+00:00,Quarto,0.012730305
ao informar q minha reserva era com estacionamento free escutei um ah é verdade estou vendo aqui kkkk pelas 4 vezes (falta treinamento falta treinamemto falta treinamento ) e novamente a kauane resolveu,0,2024-10-27 19:56:07+00:00,Atendimento da equipe,0.028238477
"a privada não  funcionava, chuveiro com água fria",0,2025-01-04 15:52:07+00:00,Quarto,0.12946232
"Ao andar de meias brancas unicamente dentro do quarto as mesmas ficaram absurdamente encardidas, nitidamente faz muito tempo que o chão não vê uma higienização",0,2025-03-22 00:31:14+00:00,Quarto,0.012253129
"massa de bolo seca, parece “bolo pronto” de mercado",0,2025-07-12 00:00:00+00:00,Café da manhã,0.9008638
"os estacionamento (Parq.  das Aves, Cataratas) um assalto e não tem como escapar",0,2024-06-09 01:44:52+00:00,Localização,0.022389442
"Primeiro que ao chegar, eles passaram o ramal para ligar, chegando no quarto não tinha telefone.",0,2024-12-07 21:37:10+00:00,Quarto,0.38657582
A rampa do estacionamento muito ruim,0,2025-01-23 00:00:00+00:00,Áreas comuns,0.013247658
"Apenas o estacionamento pago deixa a desejar que fica na parte externa e precisa tocar uma campainha, pra quem precisar usar pode ser um problema",0,2024-08-28 02:25:25+00:00,Áreas comuns,0.01868393
Comida poderia ser um pouco melhor,0,2025-05-09 00:00:00+00:00,Restaurante/Bar,0.5750563
ao informar q minha reserva era com estacionamento free escutei um ah é verdade estou vendo aqui kkkk pelas 4 vezes (falta treinamento falta treinamemto falta treinamento ) e novamente a kauane resolveu,0,2024-10-27 19:56:07+00:00,Atendimento da equipe,0.028238477
Pedimos edredom que a funcionária disse que levaria e não levaram,0,2024-04-29 00:00:00+00:00,Atendimento da equipe,0.017998233
Salada de frutas apenas com mamão e melão,0,2025-07-12 00:00:00+00:00,Café da manhã,0.03820192
Paredes de papel que dava para ouvir a urina caindo no vaso dos quartos ao lado!,0,2025-05-05 00:00:00+00:00,Quarto,0.6444852
ressalvo que a qualidade do queijo e presunto poderia ser melhor.,0,2025-03-09 00:00:00+00:00,Café da manhã,0.20000653
"A água do chuveiro era pouco, até que no segundo dia, acabou e não saía mais.",0,2024-12-07 21:37:10+00:00,Banheiro,0.06359372
"poderia vir um shampoo e um condicionador, no mínimo 2 sabonetes e um pente descartável",0,2025-03-27 00:00:00+00:00,Banheiro,0.48973665
O único ponto negativo é o horário de check-out que os hotéis estão aplicando.,0,2025-01-14 16:27:57+00:00,Atendimento da equipe,0.020521658
Achei a suíte muito apertada,0,2025-03-22 00:00:00+00:00,Quarto,0.01694337
Única reclamação que o ambiente para crianças tem que pagar a parte...,0,2024-04-07 16:37:23+00:00,Áreas comuns,0.0109537905
Colchão mediano-barato (bom para máx 2 noites).,0,2025-05-06 12:52:51+00:00,Quarto,0.95725125
"a piscina principal achei pequena, pois o hotel recebe muita gente",0,2025-03-11 00:00:00+00:00,Áreas comuns,0.1010831
Piscina lotada.,0,2025-04-26 00:00:00+00:00,Áreas comuns,0.74360514
Academia em reforma e desconfortável,0,2025-07-22 00:00:00+00:00,Áreas comuns,0.017211728
"o menu de drinks é bem pequeno e os destilados são de segunda linha,N tinha importados nem destilados de melhor qualidade",0,2025-07-09 19:19:58+00:00,Restaurante/Bar,0.033565756
a comunicação é péssima,0,2024-01-06 00:00:00+00:00,Atendimento da equipe,0.01212114
mas tivemos de pedir para limpar a mesa que estávamos (muito provavelmente pelo fluxo de pessoas),0,2025-02-23 00:00:00+00:00,Café da manhã,0.07080199
"um dos recepcionista nos falto com respeito, nao nos ajudando a resolver o problema da garagem",0,2025-06-22 00:00:00+00:00,Atendimento da equipe,0.011227349
